{
  "schema": "helix.browser-execution-report/1",
  "plan_item": "P02-015",
  "recorded_at": "2026-07-11T07:02:45.315Z",
  "selection": "webkit",
  "playwright_version": "1.61.1",
  "browser_identities": [
    {
      "engine": "webkit",
      "revision": "2311",
      "browser_version": "26.5",
      "launcher_bytes": 3049,
      "launcher_sha256": "a85baad3d8c07173ac387a59b41500c382b21ed692afe0964d29aac247ccc63b"
    }
  ],
  "stats": {
    "duration_ms": 7364,
    "expected": 1,
    "skipped": 0,
    "unexpected": 0,
    "flaky": 0
  },
  "tests": [
    {
      "file": "tests/browser/bundle-smoke.spec.ts",
      "line": 5,
      "column": 1,
      "title": "shows its non-database boundary and instantiates the bundled core Wasm",
      "project": "webkit",
      "status": "passed",
      "expected_status": "passed",
      "retry": 0,
      "duration_ms": 5332,
      "errors": [],
      "attachments": []
    }
  ],
  "failures": [],
  "verdict": "pass"
}
