{
  "schema": "helix.browser-execution-report/1",
  "plan_item": "P02-015",
  "recorded_at": "2026-07-11T04:58:22.874Z",
  "selection": "firefox",
  "playwright_version": "1.61.1",
  "browser_identities": [
    {
      "engine": "firefox",
      "revision": "1532",
      "browser_version": "151.0",
      "launcher_bytes": 579040,
      "launcher_sha256": "05fa1371ab7dd4ce2b2efea456aa0cc887f8c82a910d9ddc5ea5414071abbf03"
    }
  ],
  "stats": {
    "duration_ms": 2605,
    "expected": 1,
    "skipped": 0,
    "unexpected": 0,
    "flaky": 0
  },
  "tests": [
    {
      "file": "tests/browser/bundle-smoke.spec.ts",
      "line": 5,
      "column": 1,
      "title": "loads, validates, compiles, and instantiates the bundled core Wasm",
      "project": "firefox",
      "status": "passed",
      "expected_status": "passed",
      "retry": 0,
      "duration_ms": 954,
      "errors": [],
      "attachments": []
    }
  ],
  "failures": [],
  "verdict": "pass"
}
