{
  "schema": "helix.browser-execution-report/1",
  "plan_item": "P02-015",
  "recorded_at": "2026-07-11T05:40:20.733Z",
  "selection": "all",
  "playwright_version": "1.61.1",
  "browser_identities": [
    {
      "engine": "chromium",
      "revision": "1228",
      "browser_version": "149.0.7827.55",
      "launcher_bytes": 278568152,
      "launcher_sha256": "2d18db9d8608b052b6a552ee00ec1e830f93692e928b65ecc67d693bd33fe801"
    },
    {
      "engine": "firefox",
      "revision": "1532",
      "browser_version": "151.0",
      "launcher_bytes": 579040,
      "launcher_sha256": "05fa1371ab7dd4ce2b2efea456aa0cc887f8c82a910d9ddc5ea5414071abbf03"
    },
    {
      "engine": "webkit",
      "revision": "2311",
      "browser_version": "26.5",
      "launcher_bytes": 3049,
      "launcher_sha256": "a85baad3d8c07173ac387a59b41500c382b21ed692afe0964d29aac247ccc63b"
    }
  ],
  "stats": {
    "duration_ms": 6587,
    "expected": 3,
    "skipped": 0,
    "unexpected": 0,
    "flaky": 0
  },
  "tests": [
    {
      "file": "tests/browser/bundle-smoke.spec.ts",
      "line": 5,
      "column": 1,
      "title": "shows its non-database boundary and instantiates the bundled core Wasm",
      "project": "chromium",
      "status": "passed",
      "expected_status": "passed",
      "retry": 0,
      "duration_ms": 1636,
      "errors": [],
      "attachments": []
    },
    {
      "file": "tests/browser/bundle-smoke.spec.ts",
      "line": 5,
      "column": 1,
      "title": "shows its non-database boundary and instantiates the bundled core Wasm",
      "project": "firefox",
      "status": "passed",
      "expected_status": "passed",
      "retry": 0,
      "duration_ms": 1256,
      "errors": [],
      "attachments": []
    },
    {
      "file": "tests/browser/bundle-smoke.spec.ts",
      "line": 5,
      "column": 1,
      "title": "shows its non-database boundary and instantiates the bundled core Wasm",
      "project": "webkit",
      "status": "passed",
      "expected_status": "passed",
      "retry": 0,
      "duration_ms": 820,
      "errors": [],
      "attachments": []
    }
  ],
  "failures": [],
  "verdict": "pass"
}
